"TEAM NAMES","Series Number","Filename","Name","Description","Gender","Attributes","UUID","HASH"
"","280","nicole-sleep-warrior","nicole sleep warrior","Nicole holds the sleep award in our community, she wouldn't wake up at the sound of a detonated nuclear bomb.","Female","hair:black; eyes: closed; teeth: none; clothing: multicolour ankara with red base; accessories: none; expression: none; strength: leadership; weakness: initiative","710ae821-4603-4124-bd60-a33b515b3b8d","0e0e94bbdc50fb89f305cbbdbfba28ca6b7abc642a1e3bf0dc65a7da609a40a0""TEAM NAMES","Series Number","Filename","Name","Description","Gender","Attributes","UUID","HASH"
"TEAM HYDRAULICS","281","busola-the-shakara","busola the shakara","She is a fashion icon that loves luxurious items.","Female","hair: brown; eyes: shades; teeth: closed; clothing: yellow and blue ankara; accessories: shades; expression: passive; strength: confident; weakness: over spending","ec4a855a-5ceb-4f1b-bbd7-a995aa45e875","800404439b51030771d01c7161f70b2896a5fe1caf08918cf849d2dbf80fb9a1""TEAM NAMES","Series Number","Filename","Name","Description","Gender","Attributes","UUID","HASH"
"","282","bella-the-artist","bella the artist","A lady that host a fashion week show","Female","hair: blond; eyes: shades; teeth: closed; clothing: black and yellow ankara; accessories: shades; expression: straight face; strength: creativity; weakness: perfectionist","48772412-dacb-4984-9e82-8d24fe101265","de676dd8db8844c8162b413272166c29879b0b6cc93f0b9792ae6f64ec724f75""TEAM NAMES","Series Number","Filename","Name","Description","Gender","Attributes","UUID","HASH"
"","283","queen-the-extrovert","queen the extrovert","A woman who enjoys being high all the time","Female","hair: brown; eyes: shades; teeth: closed; clothing: multi colored ankara; accessories: shades and smoking pipe; expression: sassy; strength: self assured; weakness: conceited","1712532a-20d9-4ccb-8582-bffd76c9fb67","67fa7a74e5fee9bbe89bc1e16b13d129935b19da3c6ea6e2d4345d79f7492672""TEAM NAMES","Series Number","Filename","Name","Description","Gender","Attributes","UUID","HASH"
"","284","mary-toxic-lady","mary toxic lady","A lady who is toxic around people","Female","hair: two buns; eyes: shades; teeth: white; clothing: animal prints; accessories: shades; expression: angry; strength: bully; weakness: insecurity","bc31af8d-c45d-4797-adfc-596fb22e4e3a","f42f4998e267b1027000a6810f434af4c3a35da1a49b0d32949d41b05698d550""TEAM NAMES","Series Number","Filename","Name","Description","Gender","Attributes","UUID","HASH"
"","285","elizabeth-the-richkid","elizabeth the richkid","A university undergraduate from a rich background","Male","hair: blond; eyes: shades; teeth: closed; clothing: blacktop; accessories: shades; expression: straight face; strength: wealth; weakness: lack of real friends","21fad782-1b6f-4c2d-b157-9fdb9355c876","a8bb5a7eb6d70f56f14502cabc3b29092565c5d30dfb5f3aa5dcc9b81a9fb5a8""TEAM NAMES","Series Number","Filename","Name","Description","Gender","Attributes","UUID","HASH"
"","286","larry-the-westerner","larry the westerner","A Yoruba Man who smokes his pipe in peace","Male","hair: covered; eyes: white; teeth: closed; clothing: purple and yellow agbada; accessories: cap and smoking pipe; expression: passive; strength: likes to be in control; weakness: lazy","d4984fa6-dabf-409f-839f-76742ec71500","1e1f2b8490fa3a924580941069766531329e77572af68c9fa93ddd2191cd399c""TEAM NAMES","Series Number","Filename","Name","Description","Gender","Attributes","UUID","HASH"
"","287","danjuma-the-shocked","danjuma the shocked","A pensioneer who got told his bank is on distress","Male","hair: covered; eyes: white; teeth: white; clothing: wrapper across one shoulder; accessories: cap; expression: shocked; strength: hard worker; weakness: shyness","0187ca7f-f3b1-42ae-9e17-c46d58617608","af829959050b9dc0b8fe9ef774dd648917db8e7755e6bd5e027904218f179502""TEAM NAMES","Series Number","Filename","Name","Description","Gender","Attributes","UUID","HASH"
"","288","yomi-the-fashionista","yomi the fashionista","Winner of the Lagos GT Bank fashion week.","Male","hair: covered; eyes: white; teeth: white; clothing: wrapper across one shoulder; accessories: cap; expression: shocked; strength: hard worker; weakness: lack of wealth","16d256ba-dc4e-4559-ae41-59779f351ad3","9deda0d8c3fead56deff1f610145a3ebd26f0e660e0f0f4830b130ae96f160e0""TEAM NAMES","Series Number","Filename","Name","Description","Gender","Attributes","UUID","HASH"
"","289","ibu-the-importer","ibu the importer","A rich man who steps on people's toes","Male","hair: covered; eyes: light blue; teeth: white and a gold tooth; clothing: isi-agu; accessories: cap; expression: straight face; strength: wealth; weakness: irrational","d3edc876-3f2f-4699-a376-0787bb06c5d5","987d40ee43dfe17ed7195d69f20333a6416084b2f1536dabf03bd0835a521dec""TEAM NAMES","Series Number","Filename","Name","Description","Gender","Attributes","UUID","HASH"
"","290","massa-the-ghanian","massa the ghanian","A rich trader who loves giving back to the community","Male","hair: covered; eyes: closed; teeth: white; clothing: akan; accessories: cap; expression: happy; strength: wealth; weakness: irrational","9a9a5fbd-7a3c-469c-95f2-50303c2e9fc8","45f41ac725d12cc7bee31518b96e982c25e0fbef5819764a3d87cf9e3c374fdf""TEAM NAMES","Series Number","Filename","Name","Description","Gender","Attributes","UUID","HASH"
"","291","james-the-musician","james the musician","A Nigerian based musician who host shows","Male","hair: brown; eyes: closed; teeth: white; clothing: akan; accessories: none; expression: happy; strength: good voice; weakness: womanizer","0d4ad447-3836-47cd-8387-066b200cda01","270a34d9bc21ca4a5e0f11d3773d9ccc015a5fb763a7a30260e6ae6b75adb6ca""TEAM NAMES","Series Number","Filename","Name","Description","Gender","Attributes","UUID","HASH"
"","292","gbenga-titled-man","gbenga titled man","A chief who is very ambitious in his pursuits for fame","Male","hair: covered; eyes: light blue; teeth: white with a gold tooth; clothing: akan; accessories: none; expression: emotional; strength: friendly; weakness: deceitful","dc6c1a39-ec78-44ca-8296-68c6de7b5de4","69aa43f3e57d157133015d2ce0cf98d672f386fde97be69dd73fbe199972616b""TEAM NAMES","Series Number","Filename","Name","Description","Gender","Attributes","UUID","HASH"
"","293","abaga-the-rapper","abaga the rapper","A flashy millionaire and a music rapper","Male","hair: covered;eyes: closed; teeth: white; clothing: dongri and yellow t-shirt; accessories: cap; expression: happy; strength: wealth; weakness: recklessness","c428411c-5a06-4b74-bd17-e53b76f9fc6c","d0359f55229c77f8d530b7187549f16d1114231c0bd6584deea965e7411b880a""TEAM NAMES","Series Number","Filename","Name","Description","Gender","Attributes","UUID","HASH"
"","294","izuchukwu-the-fisherman","izuchukwu the fisherman","A fisherman who knows how to paddle well","Male","hair: covered; eyes: closed; teeth: white with a gap tooth; clothing: green shirt; accessories: cap; expression: dozzy; strength: great body-build; weakness: drunkard","15e1caf2-06b3-45d8-9b35-f95965b64e34","137b41acc798003f90c40460c68f13202b4ca1886c57ef5bbe0cc72dca9ac1cb""TEAM NAMES","Series Number","Filename","Name","Description","Gender","Attributes","UUID","HASH"
"","295","mark-the-philanthropist","mark the philanthropist","A London based philantropist.","Male","hair: brown; eyes: white; teeth: closed; clothing: white and blue shirt; accessories: none; expression: irritated; strength: philanthropist; weakness: anger issues","b48cbd98-96c2-4ec4-9d17-2c798be5b90f","b626d8f49e31ee64cd510b5d4c3ec881c4d388e56f3e91f0300b74380761efaa""TEAM NAMES","Series Number","Filename","Name","Description","Gender","Attributes","UUID","HASH"
"","296","desmond-the-politician","desmond the politician","A young politician who just became a minister","Male","hair: covered; eyes: grey; teeth: closed; clothing: yellow and purple agbada; accessories: ila; expression: smirk; strength: team player; weakness: deceitful","c52d4fbb-622b-4e2b-85a9-1a1d0f3d97d6","14a7a8e24947a0bf3bf2dff3c4cae546468ed3e0e4fa12cf059d9252dc399f21""TEAM NAMES","Series Number","Filename","Name","Description","Gender","Attributes","UUID","HASH"
"","297","okoro-the-bachelor","okoro the bachelor","A local palm wine tapper with hopes and dreams","Male","hair: covered; eyes: grey; teeth: white and a gold tooth; clothing: wrapper across one shoulder; accessories: cap; expression: pretense; strength: motivated; weakness: poor","e441439d-49a3-41eb-bf9d-3c7f98c268bf","aaabb19ff0943aec906f832ca132ce812b455fe53e47878e17ac856154ea4d76""TEAM NAMES","Series Number","Filename","Name","Description","Gender","Attributes","UUID","HASH"
"","298","saro-the-clothemaker","saro the clothemaker","The yoruba man that stole the king's wife.","Male","hair: covered; eyes: grey; teeth: white; clothing: red and yellow agbada; accessories: cap; expression: straight face; strength: good-looking; weakness: womanizer","7e10af4e-1252-4f96-83a8-78411e152bae","ea197307a751678828cb6163b899421c9e3a7a37ba2e954a8d623abdd7c1ab9e""TEAM NAMES","Series Number","Filename","Name","Description","Gender","Attributes","UUID","HASH"
"","299","kalu-the-ichie","kalu the ichie","A man of wealth with afluence spreading all over the east","Male","hair: covered; eyes: sky-blue; teeth: white; clothing: orange plain and pattern shirt; accessories: cap; expression: happy; strength: wealth; weakness: pride","482ab247-73a4-4ff8-9172-732f3d0729b8","edc9a610f8d1228250ab94addbca28dcdee5c165493aadd871fb8bc6500d97f9""TEAM NAMES","Series Number","Filename","Name","Description","Gender","Attributes","UUID","HASH"
"","300","tamuno-the-prince","tamuno the prince","An Ijaw prince who is also the heir to the throne","Male","hair: covered; eyes: sky-blue; teeth: closed; clothing: akan;  accessories: cap; expression: straight-face; strength: caring; weakness: easily deceived","108447d1-f2d5-4816-8ebb-599286c3fabf","55057d57069a233e865cbaf1cca618f40d7c1a89efa74bf8c1106388e9144d5a""TEAM NAMES","Series Number","Filename","Name","Description","Gender","Attributes","UUID","HASH"
"TEAM SCALE","301","wendy-the -banker","wendy the  banker","Wendy loves working in the bank, as she gets to meet different people.","Female","hair: dark red; eyes: blue; teeth:none; clothing: blue and yellow ankara; accessories: none; expression: shocked; strength: none; weakness: none","1d51d23f-912a-4616-b265-2a4fd8f48260","9c2f79a4decfa32efe400e201886f8ed4b75cadc714d9c9eb64d0c3bcc945f2b""TEAM NAMES","Series Number","Filename","Name","Description","Gender","Attributes","UUID","HASH"
"","302","uduak-the -dark horse","uduak the dark horse","Uduak looks innocent and has the whole apartment bugged","Female","hair: brown; eyes: blue; teeth:none; clothing: multi-colored ankara; accessories: none; expression: witty; strength: none; weakness: none","4fc5ee8f-6b10-4a06-a799-317c9a8344e2","b0eda6f077ee27ccd23ea798051600a27e987acac0f488b1ac3efa6c14f25525""TEAM NAMES","Series Number","Filename","Name","Description","Gender","Attributes","UUID","HASH"
"","303","timeyin-the -eccentic","timeyin the eccentic","Timeyin is as eccentric as they come with no care for others opinions","Female","hair: brown; eyes: blue; teeth:none; clothing: multi-colored ankara; accessories: smoking pipe; expression: high; strength: none; weakness: none","55aa2446-52d0-4b4e-af61-788784a29d8d","aea9e2ca6ecbc30df415a08f3dad1e1324df40a622df8ecd7835a1529c570792""TEAM NAMES","Series Number","Filename","Name","Description","Gender","Attributes","UUID","HASH"
"","304","omawunmi-the -businesswoman","omawunmi the businesswoman","Omawunmi is a no-nonsense woman with a shop in idumota","Female","hair: pink; eyes: blue; teeth: white teeth; clothing: yellow ankara; accessories: none; expression: angry; strength: none; weakness: none","678c63f7-69a5-4082-9dd2-cabf9234dbc4","5d264f57d63f5bd241f69cb50fe159debd05f49b46377bdd270dab554a867ab2""TEAM NAMES","Series Number","Filename","Name","Description","Gender","Attributes","UUID","HASH"
"","305","halima-the-housewife","halima the housewife","Halima loves to bake and cook for her children","Female","hair: brown; eyes: blue; teeth: none; clothing: ankara designed with yellow red and green; accessories: none; expression: tired; strength: none; weakness: none","2275b7d4-fee8-483f-adfb-517ec3f25f3d","58f7c270b34a5d9d451962dc759667e7fbe4ed854962d0e71825df5920e8bf41""TEAM NAMES","Series Number","Filename","Name","Description","Gender","Attributes","UUID","HASH"
"","306","muna-the -block sister","muna the block sister","Muna loves to tell everyone in the block about her younger escapades","Female","hair: black; eyes: blue; teeth: none; clothing: wolf skin ankara; accessories: headgear; expression: shocked; strength: none; weakness: none","86decb02-71e9-4826-bfdd-611db2f9d95e","65bb62a2ece29c875a0da02c3276f13463da4a58ee11e1b3b8a56298fb59343d""TEAM NAMES","Series Number","Filename","Name","Description","Gender","Attributes","UUID","HASH"
"","307","stella-the -gossip","stella the gossip","Nobody gossips on the block like stella when smoking.","Female","hair: red; eyes: covered eyes; teeth: none; clothing: black ankara with bright design; accessories: none; expression: calm; strength: none; weakness: none","9d6d17db-eca7-462c-b975-214a93198914","857179f853245e87a6d9a643447ff9ba88c921a4bdf73891c948ae776ab256b3""TEAM NAMES","Series Number","Filename","Name","Description","Gender","Attributes","UUID","HASH"
"","308","agbani-the-wannabe","agbani the wannabe","Agbani loves to shop antique decorations for her mansion in Idi-Iroko.","Female","hair: purple hair; eyes: covered eyes; teeth: none; clothing: blue one-armed dress; accessories: none; expression: happy; strength: none; weakness: none","baab2dff-73fc-44f8-9c1b-3473018a1e32","dfc31d904359a2a34119f69ee5f8e62b10dba44a955b96cac3e35aaf8cc7c8ca""TEAM NAMES","Series Number","Filename","Name","Description","Gender","Attributes","UUID","HASH"
"","309","asante-the -warrior","asante the warrior","Asante came from a long line of warriors in Ghana.","Female","hair: pink braids; eyes: covered eyes; teeth: none; clothing: one-armed brightly colored dress; accessories: none; expression: calm; strength: none; weakness: none","c7a25f63-441e-49db-9718-6f48dfcb6b7d","e046c74c882b6b29ad8168349f76d37a0bc7d7d447c39774c52f1ca7c07cabe9""TEAM NAMES","Series Number","Filename","Name","Description","Gender","Attributes","UUID","HASH"
"","310","hilda-the -insomaniac","hilda the insomaniac","Hilda prefers to sleep during the day.","Female","hair: pink; eyes: covered eyes; teeth: none; clothing: multi colored ankara; accessories: none; expression:calm; strength: none; weakness: none","10d02fba-84c8-40bd-b7d6-f27d9431be7f","a1096156c96db2ef235f254c29c3137f763e5604934fb67f6e34461f56dff582""TEAM NAMES","Series Number","Filename","Name","Description","Gender","Attributes","UUID","HASH"
"","311","sisi yemi-the -street aunty","sisi yemi the street aunty","Sisi Yemi is everyone's favourite street aunty.","Female","hair: dark brown; eyes: brown eyes; teeth: none; clothing: blue and yellow ankara; accessories: none; expression: shocked; strength: none; weakness: none","196bd3ac-165d-4c28-bb43-fdc4e95d3e7b","0adc72ce65ff274c433786ef01978b81967c062ffa3a09bc01777dc373e47e22""TEAM NAMES","Series Number","Filename","Name","Description","Gender","Attributes","UUID","HASH"
"","312","chiamaka-the -bully","chiamaka the bully","Chiamaka hates people in her business and likes to scare the kids on the block.","Female","hair: pink; eyes: brown; teeth: none; clothing: multi-colored ankara; accessories: smoking pipe; expression: strong; strength: none; weakness: none","10f44a39-9d46-43e1-a650-b288fcef2564","93f13c56655536bd62c4e3f0fcdc5360445d9388ea591b802b84822e16d2dcf2""TEAM NAMES","Series Number","Filename","Name","Description","Gender","Attributes","UUID","HASH"
"","313","gift-the-fashionista","gift the fashionista","Gift has always been bold and that spreads to her fashion sense too.","Female","hair: brown; eyes: brown; teeth :none; clothing: multi-colored ankara; accessories: none; expression: witty; strength: none; weakness: none","0775764b-bd66-45eb-95db-ed0bc3b4ce96","7b1413915c822903424a4b7d54d0f0e8ea4df956720acd0f7c23b433f147a39f""TEAM NAMES","Series Number","Filename","Name","Description","Gender","Attributes","UUID","HASH"
"","314","omoyene-the-weirdo","omoyene the weirdo","Omoyene likes to murmur to herself and talks about seeing ghosts.","Female","hair: brown; eyes: brown; teeth: none; clothing: yellow ankara; accessories: none; expression: calm; strength: none; weakness: none","f937a43e-4068-4239-81fc-2d38b805bb24","775eefe2f980ab3fce2e28e68826dadce59695d25f422054ed0cf0fe4e786276""TEAM NAMES","Series Number","Filename","Name","Description","Gender","Attributes","UUID","HASH"
"","315","maria-the -freshface","maria the freshface","Maria likes to believe the world is sunshine and rainbows while blowing gum.","Female","hair: pink; eyes: brown eyes; teeth: white teeth; clothing: yellow green and red ankara; accessories: none; expression: furious; strength: none; weakness: none","ad9e356a-eac3-4b88-ab26-d5b160480f79","4670b9e4ee8a1f13d10b21d52cd25bafcb8307de11606837275b820931809733""TEAM NAMES","Series Number","Filename","Name","Description","Gender","Attributes","UUID","HASH"
"","316","monica-the -smoker","monica the smoker","Monica is never found without a pipe and loves to interject in every conversation.","Female","hair: grey; eyes: covered eyes; teeth: none; clothing: black ankara with bright designs; accessories: yellow glasses; expression: hip; strength: none; weakness: none","328fcef2-81c3-4620-9446-c472ba7495ea","8473fee08a5d71c02ef78e8ebba637d37a7009329f2854af26b9f72cf48b4463""TEAM NAMES","Series Number","Filename","Name","Description","Gender","Attributes","UUID","HASH"
"","317","janet -is always -found singing","janet the singer","Janet is always found singing in whatever activity shes doing.","Female","hair: purple; eyes: covered eyes; teeth: none; clothing: yellow and blue ankara; accessories: yellow glasses; expression: cool; strength: none; weakness: none","50393214-af0c-4e21-88f7-5c031c46a8b4","951434068c1e8908bae8ad0c969ed46c426f60d4d823c0872a4a9e79c5eabb98""TEAM NAMES","Series Number","Filename","Name","Description","Gender","Attributes","UUID","HASH"
"","318","emi-the-reggae-girl","emi the reggae girl","EMi is a beautiful dancer; she rules the reggae world.","Female","hair:pink braids; eyes: covered eyes; teeth: none; clothing: multicolored ankara; accessories: yellow glasses; expression: happy; strength: none; weakness: none","a5435181-91be-47eb-9df1-002115e1fbdd","3a2d146e744fe7cf954af5e4567b3af0bbe6913b5b3c134b6d9aa5930d06d770""TEAM NAMES","Series Number","Filename","Name","Description","Gender","Attributes","UUID","HASH"
"","319","aisha-love-the-life-of-the-party","aisha love the life of the party","Aisha always party during the weekend.","Female","hair: red; eyes: covered eyes; teeth: none; clothing: wolf skin ankara; accessories: yellow glasses; expression: hip; strength: none; weakness: none","04eb2777-ccee-411d-be96-dfd02605b329","f7057e0989470772331ed586010a6451a96736857fc76c8aa3b5dad0cbd3379f""TEAM NAMES","Series Number","Filename","Name","Description","Gender","Attributes","UUID","HASH"
"","320","amaka-the-tailor","amaka the tailor","She sews the most beautiful dress in the hood.","Female","hair: grey; eyes: covered eyes; teeth: none; clothing: black dress; accessories: yellow glasses; expression: happy; strength: none; weakness: none","df0f57cd-1b63-4345-a5e3-1ee60d81d98c","a9f3716fc7ec2709c60d095220c72c14cccea8f9d2a6f03dc96856491d5db72c""TEAM NAMES","Series Number","Filename","Name","Description","Gender","Attributes","UUID","HASH"
"TEAM SANDPAPER","321","omunyinyi-the-stoic","omunyinyi the stoic","Omunyinyi wears a Kitenge coat.","Male","hair: bald; eyes: teary; teeth: none; clothing: checked ankara; accessories: none; expression: teary; strength: powerful; weakness: self-loathing","c2d6a3ac-1d4d-4268-ba7f-4f0f8f50c1ab","a55634cdf3dc29b8e150ad0a6156895eacb29f07f3896f5599ce79ef634aefe6""TEAM NAMES","Series Number","Filename","Name","Description","Gender","Attributes","UUID","HASH"
"","322","kamau-the-sleeper","kamau the sleeper","Kamau has his eyes closed as he meditates.","Male","hair: bald; eyes: closed; teeth:  none;  clothing: black ankara; accessories: none; expression: flat; strength: open to suggestion; weakness: always sleepy","20330f5c-40c2-4f6a-b9d8-d1d04fb97daf","81366c3a6c759a4fe7ceb2e5b6dc4cc7d62e868e6dab2b2de57f78bdec493395""TEAM NAMES","Series Number","Filename","Name","Description","Gender","Attributes","UUID","HASH"
"","323","mutiso-the-lastborn","mutiso the lastborn","Mutiso is masked up but dozes off while waiting for food.","Male","hair: bald; eyes: closed; teeth: none;  clothing: yellow ankara; accessories: none;  expression: tired; strength: consistency; weakness: pessismist","0706c338-42eb-4d26-84ea-c24b39628200","da649841c83917e884cff0d3dacd438a847f7f074150431ec63c19d49345e9c8""TEAM NAMES","Series Number","Filename","Name","Description","Gender","Attributes","UUID","HASH"
"","324","omondi-the-vegeterian","omondi the vegeterian","Omondi wears a green coat with lots of patterns.","Male","hair: bald; eyes: sharp eyed; teeth: none;  clothing: green ankara; accessories: none; expression: alert; strength: leader; weakness: anxious","bfb5e8d5-d7a7-4aa8-85e8-d7d9afd4adb3","f34050e1572a0929ff177f62335d9ff740631f53846a365556f6aeb2d0988bbe""TEAM NAMES","Series Number","Filename","Name","Description","Gender","Attributes","UUID","HASH"
"","325","barasa-the-optimist","barasa the optimist","Barasa looks up to the sky and makes a wish.","Male","hair: bald; eyes: blue; teeth: none; clothing: brown ankara; accessories:none; expression: awake; strength: strong willed; weakness: immoral","2da4bef4-38cc-4414-99ad-7361fac04b2b","e7034111188efc132b643263274ef79fba402a3bb37c1089d79a7022599231f5""TEAM NAMES","Series Number","Filename","Name","Description","Gender","Attributes","UUID","HASH"
"","326","mwembu-the-elder","mwembu the elder","Mwembu is old but not so old and yellow is his favorite color.","Male","hair: bald; eyes: black; teeth: none; clothing: dark ankara; accessories: none; expression: plain; strength: fulfilled; weakness: angry","36181230-6ac9-417f-af5c-23bdd2c25ecb","35f791e03eb35347a55d9b32f43ead78de94aea910ecc89c024604175275274e""TEAM NAMES","Series Number","Filename","Name","Description","Gender","Attributes","UUID","HASH"
"","327","mbogi-the-fighter","mbogi the fighter","Mbogi is captured and forced to wear a mask.","Male","hair: bald; eyes:  black; teeth: none; clothing: one side ankara; accessories: none; expression: willfull; strength: fighter; weakness: rebellious","3a7bc3c4-1463-42ce-84c9-07337da64435","9b24a324bd581346238997bc41a2f487196e4490d2e0b7f93b98eb8e9f12ae2f""TEAM NAMES","Series Number","Filename","Name","Description","Gender","Attributes","UUID","HASH"
"","328","mrosho-the-runner","mrosho the runner","Mrosho has his mask on and yet still runs his race.","Male","hair: bald; eyes: sea blue; teeth: none; clothing: purple ankara; accessories: none; expression: alert; strength: visionary; weakness: destructive","b2ca2c76-3b6d-43f1-8cc9-089b6ab83876","ce93588b797d7a2e62ea616438b0ace92f5274642c3c745051e76bc8fb3610e9""TEAM NAMES","Series Number","Filename","Name","Description","Gender","Attributes","UUID","HASH"
"","329","milele-the-african","milele the african","Milele wears a dress with a nice african print in orange.","Male","hair: bald; eyes: blue; teeth: none; clothing: orange ankara; accessories: none; expression: timid; strength: leader; weakness: failure","644b0259-d75c-456d-934c-ce7c052bad3a","da0032821ed7be498eb8454a7ccc267f9a5f27eba9303daa105ebfba23bcc3bc""TEAM NAMES","Series Number","Filename","Name","Description","Gender","Attributes","UUID","HASH"
"","330","olebon-the-oloibon","olebon the oloibon","Olebon is in a customized buba sokoto.","Male","hair: bald; eyes: closed; teeth: none; clothing: animal print; accessories: none; expression: surprised; strength: empathy; weakness: easily bored","de261efe-731d-461e-b2e4-42edd2f48f72","9d7269c68921feecc43434d1ea179ba839a71ab75d5b3bbb111c219eaba76aca""TEAM NAMES","Series Number","Filename","Name","Description","Gender","Attributes","UUID","HASH"
"","331","chifu-the-maasai","chifu the maasai","Maasai shuka keeps bringing inspiration for new clothings.","Male","hair: bald; eyes: closed; teeth: none; clothing: ankara shirt; accessories: none; expression: visionary; strength:  authentic; weakness: selfish","239933c4-7177-4b5b-86e8-e6f952301344","ea6950604bbb59d743b0522985d882b11bacc71b1b839a55f1052819681fa422""TEAM NAMES","Series Number","Filename","Name","Description","Gender","Attributes","UUID","HASH"
"","332","mwangaa-the-voice","mwangaa the voice","Mwangaa the chief is controlling but still loved as he has a calming voice.","Male","hair: bald; eyes: blue; teeth: none; clothing: white lined ankara; accessories: none; expression: kindness; strength: brave; weakness: impatient","49179b62-812d-4d0f-b518-4af7fa79f8bc","9c016bb015b9aba8fb8abf8f521949226f50486e468bed428564cb10134e929b""TEAM NAMES","Series Number","Filename","Name","Description","Gender","Attributes","UUID","HASH"
"","333","waforte-the-first","waforte the first","Waforte loves to sleep and does nothing else.","Male","hair: bald; eyes: closed; teeth:none; clothing: jean ankara; accessories: none; expression: shy; strength: none;  weakness: selfish","871912a8-d96e-4594-b7b3-450d94ee6924","740f0daf0b54663ab4d1dd27a1136a8af23654c9c5771cb3000d0d7ffb1590c3""TEAM NAMES","Series Number","Filename","Name","Description","Gender","Attributes","UUID","HASH"
